[
  {
    "evidence_id": "58cfd053-6a65-4d01-a470-b18954717931",
    "type": "wallet_reuse",
    "score": 0.97,
    "source_doc_a": "9a4c25e0-f492-4461-94f0-1b9111e7a320",
    "source_doc_b": "a68f3fe9-d848-4f59-a9ab-d473ef5452ad",
    "details": {
      "summary": "Both posts reference the exact same wallet address (bc1qsample000wallet0001)."
    }
  },
  {
    "evidence_id": "6dab7b94-2993-4264-8fb7-d74a8ba4093d",
    "type": "stylometric",
    "score": 0.86,
    "source_doc_a": "9a4c25e0-f492-4461-94f0-1b9111e7a320",
    "source_doc_b": "a68f3fe9-d848-4f59-a9ab-d473ef5452ad",
    "details": {
      "summary": "Function-word usage and average sentence length are highly similar (~87% cosine similarity); both favor longer, formal sentences and identical phrasing patterns."
    }
  }
]